<?xml version="1.0" encoding="UTF-8"?>
<schema xmlns="http://www.w3.org/2001/XMLSchema" targetNamespace="http://www.example.org/SAFe_workflow_V4"
	xmlns:tns="http://www.example.org/SAFe_workflow_V4" elementFormDefault="qualified">

    <include schemaLocation=""></include>
    <include schemaLocation=""></include>
    <include schemaLocation=""></include>
    <element name="workflow" type="tns:SAFeSWL_OperationAnyType"></element>

	<complexType name="SAFeSWL_OperationManyType">
		<complexContent>
			<extension base="tns:SAFeSWL_OperationBaseType">
				<choice maxOccurs="unbounded" minOccurs="1">
					<element name="skip" type="tns:SAFeSWL_OperationBaseType"
						maxOccurs="1" minOccurs="1">
					</element>
					<element name="break" type="tns:SAFeSWL_OperationBaseType"
						maxOccurs="1" minOccurs="1">
					</element>
					<element name="continue" type="tns:SAFeSWL_OperationBaseType"
						maxOccurs="1" minOccurs="1">
					</element>
					<element name="start" type="tns:SAFeSWL_OperationPrimitiveInvokeActionAsyncType"
						maxOccurs="1" minOccurs="1">
					</element>
					<element name="wait" type="tns:SAFeSWL_OperationPrimitiveInvokeActionAsyncType"
						maxOccurs="1" minOccurs="1">
					</element>
					<element name="cancel" type="tns:SAFeSWL_OperationPrimitiveInvokeActionAsyncType"
						maxOccurs="1" minOccurs="1">
					</element>
					<element name="invoke" maxOccurs="1" minOccurs="1"
						type="tns:SAFeSWL_OperationPrimitiveInvokeActionType">
					</element>
					<element name="sequence" type="tns:SAFeSWL_OperationManyType"
						maxOccurs="1" minOccurs="1">
					</element>
					<element name="parallel" type="tns:SAFeSWL_OperationManyType"
						maxOccurs="1" minOccurs="1">
					</element>
					<element name="choice" maxOccurs="1" minOccurs="1" type="tns:SAFeSWL_OperationChoiceType">
					</element>
					<element name="iterate" maxOccurs="1" minOccurs="1">
						<complexType>
							<complexContent>
								<extension base="tns:SAFeSWL_OperationBaseType">
									<sequence>
										<element name="operation"
											type="tns:SAFeSWL_OperationManyType" maxOccurs="unbounded"
											minOccurs="1">
										</element>
									</sequence>
									<attribute name="max" type="int">
									</attribute>
									<attribute name="iter_label"
										type="string">
									</attribute>
								</extension>
							</complexContent>
						</complexType>
					</element>
				</choice>
			</extension>
		</complexContent>
	</complexType>



	<complexType name="SAFeSWL_OperationBaseType">
		<attribute name="order" type="int"></attribute>
		<attribute name="value" type="string"></attribute>
		<attribute name="oper_name" type="string"></attribute>
		<attribute name="level" type="int"></attribute>
        <attribute name="base_label" type="string"></attribute>
    </complexType>

	<complexType
		name="SAFeSWL_OperationPrimitiveInvokeActionType">
		<complexContent>
			<extension
				base="tns:SAFeSWL_OperationPrimitiveType">
				<attribute name="id_port" type="string"></attribute>
				<attribute name="action" type="string" use="required">
				</attribute>
			</extension>
		</complexContent>
	</complexType>

	<complexType
		name="SAFeSWL_OperationPrimitiveInvokeActionAsyncType">
		<complexContent>
			<extension
				base="tns:SAFeSWL_OperationPrimitiveInvokeActionType">
				<attribute name="handle_id" type="string"
					use="optional">
				</attribute>
			</extension>
		</complexContent>
	</complexType>




	<complexType name="SAFeSWL_OperationAnyType">
		<complexContent>
			<extension base="tns:SAFeSWL_OperationBaseType">
				<choice>
					<element name="skip" type="tns:SAFeSWL_OperationPrimitiveType"
						maxOccurs="1" minOccurs="1">
					</element>
					<element name="break" type="tns:SAFeSWL_OperationPrimitiveType"
						maxOccurs="1" minOccurs="1">
					</element>
					<element name="continue" type="tns:SAFeSWL_OperationPrimitiveType"
						maxOccurs="1" minOccurs="1">
					</element>
					<element name="start" type="tns:SAFeSWL_OperationPrimitiveInvokeActionAsyncType"
						maxOccurs="1" minOccurs="1">
					</element>
					<element name="wait" type="tns:SAFeSWL_OperationPrimitiveInvokeActionAsyncType"
						maxOccurs="1" minOccurs="1">
					</element>
					<element name="cancel" type="tns:SAFeSWL_OperationPrimitiveInvokeActionAsyncType"
						maxOccurs="1" minOccurs="1">
					</element>
					<element name="invoke" maxOccurs="1" minOccurs="1"
						type="tns:SAFeSWL_OperationPrimitiveInvokeActionType">
					</element>
					<element name="sequence" type="tns:SAFeSWL_OperationManyType"
						maxOccurs="1" minOccurs="1">
					</element>
					<element name="parallel" type="tns:SAFeSWL_OperationManyType"
						maxOccurs="1" minOccurs="1">
					</element>
					<element name="choice" maxOccurs="1" minOccurs="1" type="tns:SAFeSWL_OperationChoiceType">
					</element>
					<element name="iterate" maxOccurs="1" minOccurs="1" type="tns:SAFeSWL_OperationAnyType">
					</element>
				</choice>
			</extension>
		</complexContent>
	</complexType>

	<complexType name="SAFeSWL_OperationChoiceType">
		<sequence>
			<element name="select" type="tns:SAFeSWL_SelectionGuardType" maxOccurs="unbounded" minOccurs="1"></element>
		</sequence>
	</complexType>

	<complexType name="SAFeSWL_SelectionGuardType">
		<complexContent>
			<extension base="tns:SAFeSWL_OperationAnyType">

				<attribute name="id_port" type="string"></attribute>
				<attribute name="action" type="string"></attribute>
			</extension>
		</complexContent>
	</complexType>

	<complexType name="SAFeSWL_OperationPrimitiveType">
		<complexContent>
			<extension base="tns:SAFeSWL_OperationBaseType"></extension>
		</complexContent>
	</complexType>
</schema>